artifact_id,path,artifact_kind,role,authority,derived_from,dimension_claim,fabrication_required,notes
DESIGN-001,steel-tongue-drum-design-table.xlsx,design_table,design_table,pending_measurement,,derived_from_authority,false,Workbook-derived first-pass planning table; blocked from fabrication authority until real material thickness kerf coupon and strike data are logged.
SPEC-001,family-spec.csv,design_table,design_table,pending_measurement,DESIGN-001,derived_from_authority,false,Root-mode member and material assumptions for STD-001; actual steel thickness process behavior and tuning response remain unmeasured.
MEAS-001,validation.csv,measurement_template,measurement_template,pending_measurement,,none,false,Template for future first-strike tuning trim history mount shift finish shift drift and safety checks; contains no measured performance evidence yet.
COUPON-001,data/coupon-cam-cad-log.csv,measurement_template,measurement_template,pending_measurement,,none,false,Issue #5 coupon gate log; current row is not_run and blocks DXF/CAM authority until coupon evidence exists.
SVG-001,drawings/steel-tongue-drum-layout.svg,svg_preview,derived_preview,concept_only,DESIGN-001,derived_from_authority,false,Starter layout preview derived from workbook assumptions; not a DXF cut file CAM input or tuned geometry authority.
